{"schema_version":"1.0","record_id":"CHO-CN-0026","component_type":"chapter-opener","identity":{"book_case_id":"BOOK-CN-0070","book_title":"沂蒙田野实践","author":"李艾霞","designer":"黄姝、李艾霞","publisher":"中国中福会出版社","publication_year":2020,"language":"zh-CN"},"source":{"source_registry_id":"SRC-CN-0074","source_url":"https://beautyofbooks.cn/bookdetail?id=401","platform":"最美的书官网","collected_at":"2026-08-13","publication_year":2020,"publication_year_source_url":"https://category.dangdang.com/cp01.32.09.00.00.00-as8589934592%3A8589934769.html"},"asset":{"relative_path":"chapter-opener/assets/CHO-CN-0026.jpg","sha256":"f93027e9a7e273185a811d4181e3fe72fd134b419d5a3bb8c546d3e113e29781","mime_type":"image/jpeg","width":833,"height":556},"component_profile":{"opening_mode":"spread","visual_strategy":"mixed","chapter_number_zone":"none","chapter_title_zone":"center","image_role":"photography","text_image_relationship":"adjacent","whitespace":"medium"},"visual_decomposition":{"overall_strategy":"多层不同尺寸页面以照片、色纸与题名交替，构成田野档案入口","observations":[{"aspect":"多层页面","value":"中央暖灰页承载竖向题名，周围露出照片、黑页与高饱和彩色页边","visibility":"clear","confidence":0.95,"evidence":"当前展开书册可见多个不同尺寸页面及中央题名页","content_tags":["多层页面","照片页","色纸页"]}]},"reference_transfer":{"transferable":["不同页幅制造章节节奏","题名页与照片页交替","局部高彩色作为索引"],"avoid_copying":["不复制具体异形页、田野照片和数字图形"],"adaptation_notes":["普通装订时可用印刷色块模拟层叠关系"]},"retrieval_features":{"style_tags":["档案拼贴","多层结构","田野"],"content_tags":["乡土","摄影","档案"],"color_tags":["暖灰","黑色","粉色"],"mood_tags":["质朴","活泼","纪实"]},"lifecycle":{"status":"accumulation","created_at":"2026-08-13","updated_at":"2026-08-13"}}
