{
  "schema_version": "1.0",
  "record_id": "COV-CN-0029",
  "component_type": "cover",
  "identity": {"book_case_id": "BOOK-CN-0029", "book_title": "共产党宣言在中国", "author": "孙江（主编）", "designer": "tenmilliontimes", "publisher": "Nanjing University Press", "publication_year": 2020, "language": "zh-CN"},
  "source": {"source_registry_id": "SRC-CN-0029", "source_url": "https://tenmilliontimes.com/Manifesto-of-the-Communist-Party", "platform": "tenmilliontimes", "collected_at": "2026-08-11", "publication_year": 2020, "publication_year_source_url": "https://www.nju.edu.cn/info/3191/206341.htm"},
  "asset": {"relative_path": "cover/assets/COV-CN-0029.png", "sha256": "ca708382e06d7046219f4561655991557e55c7cd009cd9ae7febe7925b29963f", "mime_type": "image/png", "width": 1773, "height": 1333},
  "component_profile": {"cover_scope": "front", "visual_strategy": "typography", "composition": "grid", "title_zone": "center", "spine_relationship": "independent", "thumbnail_recognition": "strong"},
  "visual_decomposition": {"overall_strategy": "资产展示三个可见面；profile 只绑定中间中文题名面，其以大号红字组成三行方阵，中央嵌入年份1919，左侧窄棕条与浅灰主面形成结构分区；其余英文面和书口视图仅作同案上下文", "observations": [
    {"aspect": "中文题名方阵", "value": "红色中文题名分成三行占据浅灰主面上部至中部，1919置于中央", "visibility": "clear", "confidence": 0.99, "evidence": "当前图片中央书面可读大号红色“共产党宣言在中国”，数字1919位于汉字之间", "content_tags": ["红色巨字", "方阵", "1919"]},
    {"aspect": "多视图上下文", "value": "左侧另有棕色英文题名面，右侧展示棕色书口，准确结构角色不由该图推断", "visibility": "clear", "confidence": 0.99, "evidence": "当前图片并列三个对象：左侧英文面、中间中文面和右侧竖向书页边缘", "content_tags": ["多视图", "英文面", "书口"]}
  ]},
  "reference_transfer": {"transferable": ["用大号文字方阵承载历史主题", "将关键年份嵌入主标题网格", "在多视图记录中明确唯一profile绑定面"], "avoid_copying": ["不照搬原书红字字形和方阵顺序", "不把英文面与书口图自动解释成特定装帧结构"], "adaptation_notes": ["根据项目关键时间重建文字网格", "不同语言信息面需在实际结构确认后再分配"]},
  "retrieval_features": {"style_tags": ["历史文献", "文字方阵", "多视图"], "content_tags": ["共产党宣言", "中国", "1919"], "color_tags": ["浅灰", "红色", "棕色", "白色"], "mood_tags": ["庄重", "历史感", "纪念性"]},
  "lifecycle": {"status": "accumulation", "created_at": "2026-08-11", "updated_at": "2026-08-11"}
}
