{"schema_version":"1.0","record_id":"CHO-CN-0038","component_type":"chapter-opener","identity":{"book_case_id":"BOOK-CN-0082","book_title":"梅鉴","author":"陈鹏","designer":"许天琪、李朋蓺","publisher":"四川人民出版社","publication_year":2025,"language":"zh-CN"},"source":{"source_registry_id":"SRC-CN-0086","source_url":"https://beautyofbooks.cn/web/bookdetail?id=555","platform":"最美的书官网","collected_at":"2026-08-13","publication_year":2025,"publication_year_source_url":"https://www.96192.com/product/detail/1194381"},"asset":{"relative_path":"chapter-opener/assets/CHO-CN-0038.jpg","sha256":"cf20585fa8fc911ee7e6ec03e69e52771d99f2174c7ba423c4adbf4618255017","mime_type":"image/jpeg","width":1132,"height":800},"component_profile":{"opening_mode":"single-page","visual_strategy":"illustration","chapter_number_zone":"none","chapter_title_zone":"center","image_role":"illustration","text_image_relationship":"integrated","whitespace":"high"},"visual_decomposition":{"overall_strategy":"单页中央以数列竖排文字叠合浅彩花枝，四周保留大面积浅色空场","observations":[{"aspect":"图文叠合","value":"细小竖排文字集中在页面中央，浅粉花朵与灰绿枝叶穿插其间，周围留白充足","visibility":"clear","confidence":0.98,"evidence":"当前图片可直接见到中央竖排文字、浅彩花枝和宽阔空白","content_tags":["竖排文字","浅彩花枝","中央构图"]}]},"reference_transfer":{"transferable":["让轻量插图穿插竖排题文","用中央小尺度图文形成聚焦","以高留白保持呼吸感"],"avoid_copying":["不复制原诗文、花枝图像、字形、精确颜色或坐标","不复制原书具体页面比例"],"adaptation_notes":["用项目自身象征物替换花枝并按章题字数重排"]},"retrieval_features":{"style_tags":["古典","竖排","高留白"],"content_tags":["梅花","诗文","章题"],"color_tags":["米白","浅粉","灰绿","黑色"],"mood_tags":["清雅","安静","含蓄"]},"lifecycle":{"status":"accumulation","created_at":"2026-08-13","updated_at":"2026-08-13"}}
