{"schema_version":"1.0","record_id":"CHO-CN-0028","component_type":"chapter-opener","identity":{"book_case_id":"BOOK-CN-0072","book_title":"书之极","author":"王骥","designer":"潘焰荣","publisher":"江苏凤凰美术出版社","publication_year":2020,"language":"zh-CN"},"source":{"source_registry_id":"SRC-CN-0076","source_url":"https://beautyofbooks.cn/bookdetail?id=413","platform":"最美的书官网","collected_at":"2026-08-13","publication_year":2020,"publication_year_source_url":"https://www.thepaper.cn/newsDetail_forward_11521913"},"asset":{"relative_path":"chapter-opener/assets/CHO-CN-0028.jpg","sha256":"dac5c7e35c37960b686c5266b934de4226968006ca640b06926246c2f9c7bc61","mime_type":"image/jpeg","width":833,"height":556},"component_profile":{"opening_mode":"spread","visual_strategy":"mixed","chapter_number_zone":"top","chapter_title_zone":"top","image_role":"photography","text_image_relationship":"integrated","whitespace":"low"},"visual_decomposition":{"overall_strategy":"黑底跨页叠加作品照片、白字说明与黄色窄幅插页，形成高密度展览式入口","observations":[{"aspect":"信息密度","value":"左页白字说明与数字并置，中央黄页叠加在黑色图文跨页上","visibility":"clear","confidence":0.96,"evidence":"当前展开页可见黑底图文、黄色窄页和多层文字信息","content_tags":["黑底图文","黄色插页","展览信息"]}]},"reference_transfer":{"transferable":["深色底承载高密度图文","窄幅亮色页制造章节标记","数字与图像建立索引"],"avoid_copying":["不复制原作品照片、黄色插页尺寸和文字组合"],"adaptation_notes":["控制信息层级，避免亮色插页遮挡关键文字"]},"retrieval_features":{"style_tags":["展览式","高密度","材料层次"],"content_tags":["书籍艺术","作品图","索引"],"color_tags":["黑色","黄色","白色"],"mood_tags":["实验性","强烈","当代"]},"lifecycle":{"status":"accumulation","created_at":"2026-08-13","updated_at":"2026-08-13"}}
