{
  "schema_version": "1.0",
  "record_id": "COV-CN-0041",
  "component_type": "cover",
  "identity": {"book_case_id": "BOOK-CN-0041", "book_title": "便形鸟", "author": "朱赢椿", "designer": "朱赢椿、皇甫珊珊", "publisher": "广西师范大学出版社", "publication_year": 2017, "language": "zh-CN"},
  "source": {"source_registry_id": "SRC-CN-0041", "source_url": "https://beautyofbooks.cn/bookdetail?id=361", "platform": "BeautyOfBooks", "collected_at": "2026-08-11", "publication_year": 2017, "publication_year_source_url": "https://www.megbook.com.hk/mall/detail.jsp?proID=3090155"},
  "asset": {"relative_path": "cover/assets/COV-CN-0041.jpg", "sha256": "23f09b742b0387fd9743e32afcca28d6c18d5b68a2c452f99eb2eee3f6e85aa1", "mime_type": "image/jpeg", "width": 600, "height": 400},
  "component_profile": {"cover_scope": "front", "visual_strategy": "illustration", "composition": "centered", "title_zone": "vertical", "spine_relationship": "independent", "thumbnail_recognition": "strong"},
  "visual_decomposition": {"overall_strategy": "profile 绑定官方案例 hero 中斜置书册的米色正封：中央放射状、近对称的彩色鸟形／有机图案形成主识别，小型竖排文字保持次级；右侧窄书脊仅部分可见并承载独立文字", "observations": [
    {"aspect": "中央放射图案", "value": "米色正封中央是放射状、近对称的彩色鸟形／有机图案", "visibility": "clear", "confidence": 0.99, "evidence": "当前图片米色正封中央可见从圆形中心向外伸展的多组彩色鸟形与有机线条", "content_tags": ["彩色鸟形", "放射构图", "近对称"]},
    {"aspect": "竖排文字与书脊", "value": "正封小型竖排文字与右侧窄书脊文字分开，书脊仅部分可见", "visibility": "clear", "confidence": 0.98, "evidence": "当前图片正封中轴上下可见小型竖排文字，右侧窄面另有独立文字且只显示部分书脊", "content_tags": ["小型竖排文字", "独立书脊", "部分可见"]}
  ]},
  "reference_transfer": {"transferable": ["用中央近对称放射结构组织多组小型有机图形", "以小号竖排信息维持主图优先级", "让可见书脊承担独立文字而不干扰正面中心"], "avoid_copying": ["不复刻原鸟形、有机线条和放射数量", "不照搬原米色底与彩色组合"], "adaptation_notes": ["从新主题采集可形成放射结构的独立形态", "书脊文字须按实际厚度另行排布"]},
  "retrieval_features": {"style_tags": ["自然图谱", "放射对称", "实验插画"], "content_tags": ["鸟", "自然痕迹", "想象"], "color_tags": ["米色", "青绿", "橙红"], "mood_tags": ["好奇", "灵动", "博物感"]},
  "lifecycle": {"status": "accumulation", "created_at": "2026-08-11", "updated_at": "2026-08-11"}
}
