{"schema_version":"1.0","record_id":"CHO-CN-0041","component_type":"chapter-opener","identity":{"book_case_id":"BOOK-CN-0085","book_title":"肯特","author":"洛克威尔·肯特、汪家明、冷冰川","designer":"青云","publisher":"生活·读书·新知三联书店","publication_year":2022,"language":"zh-CN"},"source":{"source_registry_id":"SRC-CN-0089","source_url":"https://beautyofbooks.cn/web/bookdetail?id=457","platform":"最美的书官网","collected_at":"2026-08-13","publication_year":2022,"publication_year_source_url":"https://book.douban.com/isbn/9787108073501/"},"asset":{"relative_path":"chapter-opener/assets/CHO-CN-0041.jpg","sha256":"3bbc437a7029e394e5bb7669688920df5b18e513d7137f12dbaade369cf48a7b","mime_type":"image/jpeg","width":1875,"height":1250},"component_profile":{"opening_mode":"spread","visual_strategy":"typography","chapter_number_zone":"none","chapter_title_zone":"top","image_role":"none","text_image_relationship":"text-only","whitespace":"high"},"visual_decomposition":{"overall_strategy":"左页上部以前文段落收束，右页上部以短行文字开启新段，页面下部保持空白","observations":[{"aspect":"阅读过渡","value":"左页上部保留一段正文，右页上部从较短的数行文字开始，两页下半部均为空白","visibility":"clear","confidence":0.96,"evidence":"当前图片可直接见到两页上部文字与大面积下部空场","content_tags":["上部文字","前文收束","下部留白"]}]},"reference_transfer":{"transferable":["把章节入口放在页面上部","用前后文长度差建立过渡","保留下部空白控制阅读节奏"],"avoid_copying":["不复制原文、字形、行距、精确版心或坐标","不复制原书纸张色彩"],"adaptation_notes":["按项目正文规范重设上部文本区和段落长度"]},"retrieval_features":{"style_tags":["文字排版","高留白","阅读型"],"content_tags":["艺术家","导语","跨页"],"color_tags":["米白","黑色"],"mood_tags":["沉静","克制","理性"]},"lifecycle":{"status":"accumulation","created_at":"2026-08-13","updated_at":"2026-08-13"}}
