{"schema_version":"1.0","record_id":"CHO-CN-0033","component_type":"chapter-opener","identity":{"book_case_id":"BOOK-CN-0077","book_title":"自贡剪纸沈成林作品集","author":"自贡市政协文史诗书画研究院","designer":"李中果、华伟、马德龙","publisher":"四川美术出版社","publication_year":2024,"language":"zh-CN"},"source":{"source_registry_id":"SRC-CN-0081","source_url":"https://beautyofbooks.cn/web/bookdetail?id=508","platform":"最美的书官网","collected_at":"2026-08-13","publication_year":2024,"publication_year_source_url":"https://www.megbook.com.hk/mall/detail3.jsp?proID=4053797"},"asset":{"relative_path":"chapter-opener/assets/CHO-CN-0033.jpg","sha256":"1a4b3e53206ae725d43f689c8735675839ce396cc6e51fe7d455bc273d8de683","mime_type":"image/jpeg","width":1500,"height":1000},"component_profile":{"opening_mode":"spread","visual_strategy":"illustration","chapter_number_zone":"none","chapter_title_zone":"center","image_role":"illustration","text_image_relationship":"integrated","whitespace":"low"},"visual_decomposition":{"overall_strategy":"黑白剪纸图与高饱和紫粉文字页强烈并置，形成民间艺术章节入口","observations":[{"aspect":"对比关系","value":"左页黑白人物剪纸对位右页紫粉色大字与剪纸纹样","visibility":"clear","confidence":0.98,"evidence":"当前跨页可见黑白剪纸、紫粉大字和红色页边纹样","content_tags":["剪纸人物","紫粉大字","强对比"]}]},"reference_transfer":{"transferable":["黑白图与高彩标题页并置","剪纸边样形成页面框架","标题作为图形参与构图"],"avoid_copying":["不复制具体剪纸作品、紫粉配方和题名字形"],"adaptation_notes":["使用项目自有图形语汇替换剪纸纹样"]},"retrieval_features":{"style_tags":["民间艺术","高饱和","图形文字"],"content_tags":["剪纸","人物","作品集"],"color_tags":["黑色","白色","紫粉","红色"],"mood_tags":["热烈","鲜明","民俗"]},"lifecycle":{"status":"accumulation","created_at":"2026-08-13","updated_at":"2026-08-13"}}
